[
  {
    "id": "acceptance-of-delivery-modelgen-01",
    "task": "model_generation",
    "input": "\"Party A\" will be deemed to have completed its delivery obligations if in \"Party B\"'s opinion, the \"Widgets\" satisfies the Acceptance Criteria, and \"Party B\" notifies \"Party A\" in writing that it is accepting the \"Widgets\". \"Party B\" will have 10 Business Days to inspect and evaluate the \"Widgets\" on the delivery date before notifying \"Party A\" that it is either accepting or rejecting the \"Widgets\". The \"Acceptance Criteria\" are the specifications the \"Widgets\" must meet for \"Party A\" to comply with its requirements and obligations under this agreement, detailed in \"Attachment X\", attached to this agreement.",
    "expected_output": {
      "shipper": "String",
      "receiver": "String",
      "deliverable": "String",
      "businessDays": "Long",
      "attachment": "String"
    }
  },
  {
    "id": "bill-of-lading-modelgen-01",
    "task": "model_generation",
    "input": "SCAC: \"MAEU\" B/L Number: \"MAEU-ABC12345678\" Booking Number: \"2021030264747\" \"CLAUSE TECHNOLOGIES\" \"TO ORDER\" \"SAME AS CONSIGNEE\" Exporter References: \"\" Onward Instructions: \"\" Vessel: \"Lagua\" Voyage number: \"725\" Port of Loading: \"Shanghai, China\" Port of Discharge: \"Brisbane, Australia\" Place of Receipt: \"Brisbane, Australia\" Place of Delivery: \"Brisbane, Australia\" 1. Amount: 15 TONNE Package: CONTAINER Description: \"Corn\" NMFC: \"\" Freight Class: CLASS_400 Hazardous: NO 1. Amount: 35 TONNE Package: CONTAINER Description: \"Wheat\" NMFC: \"\" Freight Class: CLASS_400 Hazardous: NO",
    "expected_output": {
      "accountName": "String",
      "scac": "String",
      "bolNumber": "String",
      "bookingNumber": "String",
      "exportReferences": "String",
      "onwardInstructions": "String",
      "shipper": "String",
      "consignee": "String",
      "notifyParty": "String",
      "vessel": "String",
      "voyageNumber": "String",
      "portOfLoading": "String",
      "portOfDischarge": "String",
      "placeOfReceipt": "String",
      "placeOfDelivery": "String",
      "commodities": "Commodity[]",
      "declaredValue": "Double",
      "declaredValueCurrency": "String"
    }
  },
  {
    "id": "car-rental-tr-modelgen-01",
    "task": "model_generation",
    "input": "OTO K\u0130RALAMA S\u00d6ZLE\u015eMES\u0130 1. TARAFLAR 1.1 Kiraya Veren \u015eirket, \u015eah\u0131s, Kurum \"Acme Car Rental\" 1.2 Adresi \"Dikmen Caddesi No:48/15 Dikmen Ankara\" 1.3 Telefon \"+901231231234\" Bundan b\u00f6yle K\u0130RAYA VEREN olarak an\u0131lacakt\u0131r. 1.4 Kiralayan\u0131n Ad\u0131 Soyad\u0131 \"Can Do\u011fan\" 1.5 Adresi \"John F. Kennedy Sokak No:23/12 Kavakl\u0131dere Ankara\" 1.6 Telefon \"+901234567890\" Bundan b\u00f6yle K\u0130RALAYAN olarak an\u0131lacakt\u0131r. 2. ARA\u00c7 DETAYLARI 2.1 Plaka No \"PlakaNo\" 2.2 Marka \"Volkswagen\" 2.3 Model \"Golf 1.6 TDI Comfortline\" 2.4 Trafi\u011fe \u00c7\u0131k\u0131\u015f Y\u0131l\u0131 \"2017\" 2.5 Renk \"K\u0131rm\u0131z\u0131\" 2.6 \u015ease No \"WVWZZZ3CZXW000001\" 3. K\u0130RALAMA DETAYLARI 3.1 {{#clause payment}} \"\u0130ki Y\u00fcz On Yedi Amerikan Dolar\u0131\" (217.99 USD) \"bank transfer\". {{/clause}} 3.2 Kiralama Ba\u015flang\u0131\u00e7 Tarihi \"13.07.2018\" 3.3 Kiralama Biti\u015f Tarihi \"17.07.2018\" 3.4 Teslimat Noktas\u0131 \"Acme Car Rental Merkez Ofis\" 1. S\u00d6ZLE\u015eMEN\u0130N KONUSU \"PlakaNo\" Plaka numaral\u0131 \"Volkswagen\" marka otomobilin K\u0130RALAYAN'a kiraya verilmesi. 2. S\u00d6ZLE\u015eMEN\u0130N \u0130\u00c7ER\u0130\u011e\u0130 : Bu s\u00f6zle\u015fme taraflar\u0131n taahh\u00fctlerine ve arac\u0131n kiralanmas\u0131 \u015fartlar\u0131n\u0131 kapsar. 3. TAAHH\u00dcTNAME : S\u00f6zle\u015fmenin akidi olarak hareket eden K\u0130RAYA VEREN ve K\u0130RALAYAN a\u015fa\u011f\u0131da belirtili\u011fi \u00fczere y\u00fck\u00fcml\u00fcl\u00fcklerini kar\u015f\u0131l\u0131kl\u0131 birbirlerine taahh\u00fct edip kabul ile imzalam\u0131\u015flard\u0131r. 4. S\u00d6ZLE\u015eME \u015eARTLARI : a) K\u0130RAYA VEREN, arac\u0131 t\u00fcm fonksiyonlar\u0131 \u00e7al\u0131\u015f\u0131r vaziyette K\u0130RALAYAN'a teslim etmi\u015ftir. b) S\u00f6zle\u015fme tarihinden itibaren ara\u00e7ta meydana gelebilecek her t\u00fcrl\u00fc ar\u0131za, bak\u0131m, onar\u0131m ve yak\u0131t giderleri K\u0130RALAYAN'a aittir. Hi\u00e7 bir surette giderlerle ilgili olarak K\u0130RAYA VEREN'den \u00fccret talebinde bulunulmayacakt\u0131r. K\u0130RALAYAN arac\u0131n en iyi \u015fekilde korunmas\u0131 i\u00e7in gereken \u00f6nlemleri alacak ve her t\u00fcrl\u00fc bak\u0131m\u0131n\u0131 s\u00fcresi i\u00e7erisinde yapt\u0131racakt\u0131r. \u0130\u015f bu s\u00f6zle\u015fmeden do\u011facak herhangi bir anla\u015fmazl\u0131k durumunda \"Ankara\" mahkemelerinin yetkili oldu\u011funu taraflar kabul etmi\u015flerdir.",
    "expected_output": {
      "lessorName": "String",
      "lessorAddress": "String",
      "lessorPhone": "String",
      "lesseeName": "String",
      "lesseeAddress": "String",
      "lesseePhone": "String",
      "authorizedCourt": "String",
      "plateID": "String",
      "carBrand": "String",
      "model": "String",
      "modelYear": "String",
      "color": "String",
      "vechileID": "String",
      "startDate": "String",
      "endDate": "String",
      "deliveryStation": "String",
      "paymentClause": "PaymentClause"
    }
  },
  {
    "id": "certificate-of-incorporation-modelgen-01",
    "task": "model_generation",
    "input": "Certificate OF INCORPORATION OF \"ACME\" The name of the corporation is \"ACME\" (the \u201cCorporation\u201d). The address of the Corporation\u2019s registered office in the state of \"NY\" is \"555 main street\", in the city of \"New York\", county of \"Manhattan\", Zip Code \"10001\". The name of its registered agent at such address is \"Andie Agent\". The purpose of the Corporation is to engage in any lawful act or activity for which corporations may be organized under the Delaware General Corporation Law. The aggregate number of shares which the Corporation shall have authority to issue is 400 shares of capital stock all of which shall be designated \u201cCommon Stock\u201d and have a par value of 0.10 per share. The business and affairs of the Corporation shall be managed by or under the direction of the Board of Directors.  Elections of directors need not be by written ballot unless otherwise provided in the Bylaws of the Corporation.  In furtherance of and not in limitation of the powers conferred by the laws of the state of Delaware, the Board of Directors of the Corporation is expressly authorized to make, amend or repeal Bylaws of the Corporation. Distributions by the Corporation may be made without regard to \u201cpreferential dividends arrears amount\u201d or any \u201cpreferential rights,\u201d as such terms may be used in Section 500 of the California Corporations Code. To the fullest extent permitted by the _Delaware General Corporation Law_, as the same exists or as may hereafter be amended, a director of the Corporation shall not be personally liable to the Corporation or its stockholders for monetary damages for breach of fiduciary duty as a director. The Corporation shall indemnify to the fullest extent permitted by law any person made or threatened to be made a party to an action or proceeding, whether criminal, civil, administrative or investigative, by reason of the fact that he, his testator or intestate is or was a director or officer of the Corporation or any predecessor of the Corporation, or serves or served at any other enterprise as a director or officer at the request of the Corporation or any predecessor to the Corporation. Neither any amendment nor repeal of this Article VI, nor the adoption of any provision of the Corporation\u2019s Certificate of Incorporation inconsistent with this Article VI, shall eliminate or reduce the effect of this Article VI in respect of any matter occurring, or any action or proceeding accruing or arising or that, but for this Article VI, would accrue or arise, prior to such amendment, repeal or adoption of an inconsistent provision. Unless the Corporation consents in writing to the selection of an alternative forum, the Court of Chancery of the State of Delaware shall be the sole and exclusive forum for (A) any derivative action or proceeding asserting a claim on behalf of the Corporation, (B) any action or proceeding asserting a claim of breach of a fiduciary duty owed by any current or former director, officer, employee or agent of the Corporation to the Corporation or the Corporation\u2019s stockholders, (C) any action or proceeding asserting a claim against the Corporation arising pursuant to any provision of the Delaware General Corporation Law or the Corporation\u2019s Certificate of Incorporation or Bylaws, (D) any action or proceeding asserting a claim as to which the Delaware General Corporation Law confers jurisdiction upon the Court of Chancery of the State of Delaware, or (E) any action or proceeding asserting a claim governed by the internal affairs doctrine, in each case subject to said Court of Chancery having personal jurisdiction over the indispensable parties named as defendants therein. The name and mailing address of the incorporator are as follows: \"FooBarAtor\" \"555 oak street\" \"Baltimore\", \"MD\"  \"21201\" Executed on 04/01/2019. /s/ \"FooBarAtor\", Incorporator",
    "expected_output": {
      "companyName": "String",
      "incorporationState": "String",
      "streetAddress": "String",
      "addressRegion": "String",
      "addressLocality": "String",
      "postalCode": "String",
      "registeredAgentName": "String",
      "incorporationDate": "DateTime",
      "authorizedShareCapital": "Long",
      "parValue": "Double",
      "incorporatorName": "String",
      "incorporatorAddress": "String",
      "incorporatorCity": "String",
      "incorporatorState": "String",